{
  "$schema": "https://json-schema.org/draft/2020-12/schema",
  "$id": "https://hear-our-language.local/contracts/v0.1/utterance.schema.json",
  "title": "Utterance",
  "description": "Normalized multilingual text and optional synthesized-audio reference.",
  "type": "object",
  "additionalProperties": false,
  "required": ["schema_version", "id", "segments", "tts_provider", "audio_url", "audio_cache_key"],
  "properties": {
    "schema_version": { "const": "0.1.0" },
    "id": { "type": "string", "pattern": "^utt_[A-Za-z0-9_-]+$" },
    "segments": {
      "type": "array",
      "minItems": 1,
      "items": { "$ref": "#/$defs/segment" }
    },
    "tts_provider": { "type": ["string", "null"], "enum": ["mms-tts-nan", "windows", "prerecorded", null] },
    "audio_url": { "type": ["string", "null"], "format": "uri-reference" },
    "audio_cache_key": { "type": ["string", "null"] }
  },
  "$defs": {
    "segment": {
      "type": "object",
      "additionalProperties": false,
      "required": [
        "lang",
        "hanji",
        "tailo_citation",
        "poj_citation",
        "zh_gloss",
        "source",
        "pronunciation_status"
      ],
      "properties": {
        "lang": { "type": "string", "enum": ["nan-TW", "zh-TW"] },
        "hanji": { "type": "string", "minLength": 1 },
        "tailo_citation": { "type": ["string", "null"] },
        "poj_citation": { "type": ["string", "null"] },
        "zh_gloss": { "type": ["string", "null"] },
        "source": { "type": "string", "enum": ["textbook", "dictionary", "generated"] },
        "pronunciation_status": { "type": "string", "enum": ["verified", "converted", "needs_review"] }
      }
    }
  }
}
